B1: 1 | C1: 2 | D1: 3 | E1: 4 | F1: T | G1: Arizona 30, Atlanta 24 | H1: San Diego 23, Indianapolis 17 (OT) | I1: Baltimore 27, Miami 9 | J1: Philadelphia 26, Minnesota 14 | K1: Baltimore 13, Tennessee 10 | L1: Arizona 33, Carolina 13 | M1: Philadelphia 23, New York 11 | N1: Pittsburgh 35, San Diego 24 | O1: Arizona 32, Philadelpia 25 | P1: Pittsburgh 23, Baltimore 14
A2: Dunc | B2: 4 | C2: 3 | D2: 0 | F2: =SUM(B2:E2) -> 7 | G2: Atlanta | H2: Indianapolis | I2: Baltimore | J2: Philadelphia | K2: Tennessee | L2: Carolina | M2: New York | N2: Pittsburgh | O2: Philadelphia | P2: Baltimore
A3: Earle | B3: 6 | C3: 3 | D3: 5 | F3: =SUM(B3:E3) -> 14 | G3: Arizona | H3: San Diego | I3: Miami | J3: Philadelphia | K3: Tennessee | L3: Arizona | M3: New York | N3: San Diego | O3: Philadelphia | P3: Pittsburgh
A4: Ali | B4: 6 | C4: 3 | D4: 5 | F4: =SUM(B4:E4) -> 14 | G4: Arizona | H4: San Diego | I4: Miami | J4: Philadelphia | K4: Tennessee | L4: Arizona | M4: New York | N4: San Diego | O4: Philadelphia | P4: Pittsburgh
A5: Julie | B5: 4 | C5: 3 | D5: 10 | F5: =SUM(B5:E5) -> 17 | G5: Arizona | H5: Indianapolis | I5: Miami | J5: Philadelphia | K5: Tennessee | L5: Carolina | M5: New York | N5: Pittsburgh | O5: Arizona | P5: Pittsburgh
A6: George | B6: 8 | C6: 6 | D6: 5 | F6: =SUM(B6:E6) -> 19 | G6: Arizona | H6: San Diego | I6: Baltimore | J6: Philadelphia | K6: Baltimore | L6: Arizona | M6: New York | N6: San Diego | O6: Arizona | P6: Baltimore
A7: Aidan | B7: 4 | C7: 9 | D7: 10 | F7: =SUM(B7:E7) -> 23 | G7: Atlanta | H7: San Diego | I7: Miami | J7: Philadelphia | K7: Baltimore | L7: Arizona | M7: Philadelphia | N7: San Diego | O7: Arizona | P7: Baltimore
A8: Gavin | B8: 4 | C8: 3 | D8: 0 | F8: =SUM(B8:E8) -> 7 | G8: Lions | H8: Jets | I8: Liverpool | J8: Mets | K8: Baltimore | L8: Carolina | M8: New York | N8: San Diego | O8: Philadelphia | P8: Baltimore
A9: Moots | B9: 2 | C9: 3 | D9: 10 | F9: =SUM(B9:E9) -> 15 | G9: Arizona | H9: Indianapolis | I9: Miami | J9: Minnesota | K9: Tennessee | L9: Arizona | M9: New York | N9: Pittsburgh | O9: Arizona | P9: Pittsburgh
A10: Dad | B10: 4 | C10: 0 | D10: 10 | F10: =SUM(B10:E10) -> 14 | G10: Arizona | H10: San Diego | I10: Miami | J10: Minnesota | K10: Tennessee | L10: Carolina | M10: New York | N10: San Diego | O10: Arizona | P10: Pittsburgh
A12: Wild Card | F12: 2
A13: Divisional | F13: 3
A14: Conference | F14: 5
A15: Super Bowl | F15: 7